{
  "$schema": "../../schema/release-gate.schema.json",
  "appId": "geocam",
  "environment": "preview",
  "updatedAt": "2026-09-20T10:30:00Z",

  "killSwitch": {
    "enabled": false,
    "badge": "SYS_LOCKOUT // REMOTELY_DECOMMISSIONED",
    "title": "Build Decommissioned",
    "message": "This preview build of GeoCam has concluded its evaluation window. Please update to the latest release.",
    "contactUrl": "https://geocam.app/download"
  },

  "minBuild": {
    "enforced": false,
    "minAllowedBuildNumber": 10,
    "minAllowedVersion": "1.0.0",
    "message": "A newer build is required. Please install the latest release to continue testing."
  },

  "revokedBuilds": ["1.0.0_b5"],

  "notice": {
    "active": false,
    "blocking": false,
    "title": "Beta Notice",
    "message": "GPS Camera Beta testing is active."
  }
}
